{
  "name": "economy",
  "dimension": "cognition",
  "description": "Financial accountability â€” multi-asset wallet, track costs (inference, runtime, faculty, skill, custom), record confirmed income, maintain P&L and balance sheet, compute financial health score, adapt behavior to vitality tier and prescriptions. Powered by AgentBooks (framework-agnostic).",
  "allowedTools": [
    "Bash(node scripts/economy.js:*)"
  ],
  "envVars": ["PERSONA_SLUG", "ECONOMY_DATA_PATH", "AGENTBOOKS_AGENT_ID", "AGENTBOOKS_DATA_PATH"],
  "triggers": [
    "how much have I cost",
    "what's my balance",
    "am I profitable",
    "economic status",
    "financial health",
    "vitality tier",
    "vitality score",
    "cost breakdown",
    "wallet balance",
    "connect provider"
  ],
  "files": [
    "SKILL.md",
    "scripts/economy.js",
    "scripts/economy-guard.js",
    "scripts/economy-hook.js"
  ]
}
