{
  "name": "soul-evolution",
  "dimension": "cognition",
  "description": "Dynamic persona evolution â€” tracks relationship progression, mood, trait emergence, speaking style drift, and interest discovery across conversations",
  "allowedTools": ["Read", "Write"],
  "envVars": [],
  "triggers": [],
  "files": ["SKILL.md"]
}
