{
  "name": "music",
  "dimension": "expression",
  "description": "AI music composition via ElevenLabs Music â€” compose original songs, melodies, and instrumentals from text descriptions",
  "allowedTools": ["Bash(curl:*)", "Bash(node:*)", "Bash(npx:*)", "WebFetch"],
  "envVars": ["ELEVENLABS_API_KEY"],
  "triggers": ["compose a song", "write me a melody", "make some music", "I want to hear a song", "play something", "write a song about"],
  "files": ["SKILL.md", "scripts/compose.js", "scripts/compose.sh"]
}
